{
  "profile": "methodology",
  "sources": [
    {
      "source": "https://www.12371.cn/special/mzdxj/dyj/#investigation-practice",
      "title": "01-investigation-practice",
      "media_type": "text/plain",
      "content_hash": "d28b7cddd3a36bae9f99bd63f3b69bc771bf44383319181c46568c9821269d2d",
      "byte_count": 3564,
      "access_level": "public",
      "license": "unknown",
      "extractor": "plain-text",
      "warnings": [],
      "authority": "primary",
      "directness": "direct",
      "independence_group": "mao-authorized-works",
      "source_role": "evidence",
      "source_uri": "https://www.12371.cn/special/mzdxj/dyj/#investigation-practice",
      "creator": "毛泽东；共产党员网公开《毛泽东选集》第一卷",
      "published_at": "1937-07-01",
      "quality_score": 1.0,
      "character_count": 1615,
      "source_id": "source-20260807065604315262-316856da",
      "document_id": "document-20260806164350206068-688bdad9",
      "document_version": 3,
      "created": false,
      "active": true,
      "normalized_uri": "knowledge/normalized/document-20260806164350206068-688bdad9/3.md",
      "raw_uri": "file:knowledge/sources/d2/d28b7cddd3a36bae9f99bd63f3b69bc771bf44383319181c46568c9821269d2d/raw.md",
      "chunk_ids": [
        "chunk-54ca192bed0d1a125dc248ca",
        "chunk-248c0d6dd60cb7a2a4a13fd9",
        "chunk-de2081332c5c107683226c92",
        "chunk-16c1d9a92f9637376ce0359e",
        "chunk-9ba18b6391c82db84c2ceb8b",
        "chunk-1df456f533ffcbbfa38ed100",
        "chunk-43d388773d4be366218639a1",
        "chunk-e9d569fb447b5a474c8c5143",
        "chunk-e88a9f6341c75991d2e41cbd"
      ]
    },
    {
      "source": "https://www.12371.cn/special/mzdxj/dyj/#on-contradiction",
      "title": "02-contradiction-prioritization",
      "media_type": "text/plain",
      "content_hash": "67d1c30d5e939681a03d741ff0e6ef0df788091982a48324efc3155b95dd6ec6",
      "byte_count": 2726,
      "access_level": "public",
      "license": "unknown",
      "extractor": "plain-text",
      "warnings": [],
      "authority": "primary",
      "directness": "direct",
      "independence_group": "mao-authorized-works",
      "source_role": "evidence",
      "source_uri": "https://www.12371.cn/special/mzdxj/dyj/#on-contradiction",
      "creator": "毛泽东；共产党员网公开《毛泽东选集》第一卷",
      "published_at": "1937-08-01",
      "quality_score": 1.0,
      "character_count": 1171,
      "source_id": "source-20260807065604326533-44d161a3",
      "document_id": "document-20260806164350213918-6f5052ba",
      "document_version": 3,
      "created": false,
      "active": true,
      "normalized_uri": "knowledge/normalized/document-20260806164350213918-6f5052ba/3.md",
      "raw_uri": "file:knowledge/sources/67/67d1c30d5e939681a03d741ff0e6ef0df788091982a48324efc3155b95dd6ec6/raw.md",
      "chunk_ids": [
        "chunk-d9bc933f33851dab1a8e3e1d",
        "chunk-5542ffeac8be4afa26fa6e72",
        "chunk-165d0ef3d25789537c008a14",
        "chunk-7f28ace596588fa498f241ef",
        "chunk-e2a53dcbf0668448e6ea38cb",
        "chunk-9bda0aa59d23b7e462828585",
        "chunk-cf653bece63aca4efe43905f"
      ]
    },
    {
      "source": "https://www.12371.cn/special/mzdxj/d3j/#leadership-methods",
      "title": "03-leadership-feedback",
      "media_type": "text/plain",
      "content_hash": "8e713c363df17920a79e6059fd32c849116eda41792e50e48b19b525613d0920",
      "byte_count": 3557,
      "access_level": "public",
      "license": "unknown",
      "extractor": "plain-text",
      "warnings": [],
      "authority": "primary",
      "directness": "direct",
      "independence_group": "mao-authorized-works",
      "source_role": "evidence",
      "source_uri": "https://www.12371.cn/special/mzdxj/d3j/#leadership-methods",
      "creator": "毛泽东；共产党员网公开《毛泽东选集》第三卷",
      "published_at": "1943-06-01",
      "quality_score": 1.0,
      "character_count": 1568,
      "source_id": "source-20260807065604330869-0a1cb30c",
      "document_id": "document-20260806164350219239-010e890c",
      "document_version": 3,
      "created": false,
      "active": true,
      "normalized_uri": "knowledge/normalized/document-20260806164350219239-010e890c/3.md",
      "raw_uri": "file:knowledge/sources/8e/8e713c363df17920a79e6059fd32c849116eda41792e50e48b19b525613d0920/raw.md",
      "chunk_ids": [
        "chunk-950c429b5deb75f8c4310235",
        "chunk-f180bfe0a1a89611748edeac",
        "chunk-60941e18fa47702df2f7feb6",
        "chunk-8bc8fc5432d7bdb04ddf5830",
        "chunk-372f53ab3a5594cd1facd4ab",
        "chunk-2e1ee52a3a7dc7ba93a5047b",
        "chunk-296fb6e034e26e7294c60d7c",
        "chunk-b1e7ad35edca5e8b720db088",
        "chunk-351fdc855e5ef8d4a959e7b7"
      ]
    },
    {
      "source": "https://www.12371.cn/special/mzdxj/d4j/#committee-methods",
      "title": "04-organization-and-stages",
      "media_type": "text/plain",
      "content_hash": "91262b41dce9ac397b70320834df854f8bdb0295c90ebcc2cc7af2b08de35ebd",
      "byte_count": 2956,
      "access_level": "public",
      "license": "unknown",
      "extractor": "plain-text",
      "warnings": [],
      "authority": "primary",
      "directness": "direct",
      "independence_group": "mao-authorized-works",
      "source_role": "evidence",
      "source_uri": "https://www.12371.cn/special/mzdxj/d4j/#committee-methods",
      "creator": "毛泽东；共产党员网公开《毛泽东选集》第四卷",
      "published_at": "1949-03-13",
      "quality_score": 1.0,
      "character_count": 1241,
      "source_id": "source-20260807065604336336-39f8add9",
      "document_id": "document-20260806164350224793-95c27426",
      "document_version": 2,
      "created": false,
      "active": true,
      "normalized_uri": "knowledge/normalized/document-20260806164350224793-95c27426/2.md",
      "raw_uri": "file:knowledge/sources/91/91262b41dce9ac397b70320834df854f8bdb0295c90ebcc2cc7af2b08de35ebd/raw.md",
      "chunk_ids": [
        "chunk-3322eff1b7840ed88b68360b",
        "chunk-0ade02b0357c55e400e47639",
        "chunk-0826ed482ae37078dd1c0806",
        "chunk-093314276f105d3d22104f65",
        "chunk-2ee316c20e49fa888a6fc3f7",
        "chunk-bfa94137afbfc0eb794e15a6",
        "chunk-1016a50181dabe234bd044b7"
      ]
    },
    {
      "source": "https://www.gov.cn/test/2008-06/23/content_1024934_3.htm",
      "title": "05-official-historical-boundaries",
      "media_type": "text/plain",
      "content_hash": "4115e4b0ebd3256be58dc6e54f5b4122fa38744af325d9060867ae83f2955cd7",
      "byte_count": 4942,
      "access_level": "public",
      "license": "unknown",
      "extractor": "plain-text",
      "warnings": [],
      "authority": "official",
      "directness": "direct",
      "independence_group": "1981-central-resolution",
      "source_role": "counterevidence",
      "source_uri": "https://www.gov.cn/test/2008-06/23/content_1024934_3.htm",
      "creator": "中国共产党第十一届中央委员会第六次全体会议",
      "published_at": "1981-06-27",
      "quality_score": 0.985,
      "character_count": 2235,
      "source_id": "source-20260807065604341116-4366a3ab",
      "document_id": "document-20260806164350230666-aaa795cd",
      "document_version": 3,
      "created": false,
      "active": true,
      "normalized_uri": "knowledge/normalized/document-20260806164350230666-aaa795cd/3.md",
      "raw_uri": "file:knowledge/sources/41/4115e4b0ebd3256be58dc6e54f5b4122fa38744af325d9060867ae83f2955cd7/raw.md",
      "chunk_ids": [
        "chunk-fa32fd5b76cd1c971b966cfc",
        "chunk-9a66bea52b35291c5cb27f79",
        "chunk-36b667e5dc89ce9376f13edd",
        "chunk-73b19dee72f36644655f4af9",
        "chunk-b519b3e4331a81abcd7b94e6",
        "chunk-f3c45e60aabf080ef8998968",
        "chunk-1c59725b97e30a3b83fb011a",
        "chunk-5bc3e3d2d1150e6bc446e517",
        "chunk-cb5395335bc3be30039de27e",
        "chunk-4eb8e55450604ae6930380e5",
        "chunk-a447ebc52e53073b9a7a623a",
        "chunk-4e5aeeefc3dc6d9c34d0d829"
      ]
    },
    {
      "source": "https://www.nber.org/papers/w16361",
      "title": "06-scholarly-information-failure",
      "media_type": "text/plain",
      "content_hash": "06799c75821781bc8a4143e8f3fccfe26da34a732e72314350355b19fd7bf750",
      "byte_count": 3676,
      "access_level": "public",
      "license": "working-paper terms",
      "extractor": "plain-text",
      "warnings": [],
      "authority": "scholarly",
      "directness": "derived",
      "independence_group": "nber-meng-qian-yared",
      "source_role": "verification_anchor",
      "source_uri": "https://www.nber.org/papers/w16361",
      "creator": "Xin Meng, Nancy Qian, Pierre Yared",
      "published_at": "2010-09-01",
      "quality_score": 0.885,
      "character_count": 1705,
      "source_id": "source-20260807065604346878-72aaabe8",
      "document_id": "document-20260806164350236079-81ffe900",
      "document_version": 3,
      "created": false,
      "active": true,
      "normalized_uri": "knowledge/normalized/document-20260806164350236079-81ffe900/3.md",
      "raw_uri": "file:knowledge/sources/06/06799c75821781bc8a4143e8f3fccfe26da34a732e72314350355b19fd7bf750/raw.md",
      "chunk_ids": [
        "chunk-a8be2b4db86e3a79bcfccaf4",
        "chunk-2ffaf1efa810bb150e9ab08f",
        "chunk-f4fee5beb6f38f2b0092f253",
        "chunk-67af9c003c9c870e86a28029",
        "chunk-219d9135c68342622476f894",
        "chunk-8f948fafcd2298e4cb1b310e",
        "chunk-460cc76ba7c99574a7357af9",
        "chunk-a9392abac436e548c4dcfa1a",
        "chunk-0be0fba215026ce4a2099afe"
      ]
    },
    {
      "source": "https://www.dswxyjy.org.cn/n1/2021/0118/c219000-32003108.html",
      "title": "07-version-and-attribution",
      "media_type": "text/plain",
      "content_hash": "6dba651e8aa6229b9e18f8c1dcbeac07e33364408a13eec4876b4825b6144b48",
      "byte_count": 1951,
      "access_level": "public",
      "license": "unknown",
      "extractor": "plain-text",
      "warnings": [],
      "authority": "scholarly",
      "directness": "derived",